{
  "schema_version": "1.0.0",
  "event_id": "b7fbb1f8-fdd8-4e69-b1dc-52da0c39e789",
  "run_id": "829924f1-1d4a-4fb1-9cf0-d9c887114015",
  "sequence": 13,
  "event_type": "SECUREBLOB_CROSS_PLATFORM_FEASIBILITY_PASSED",
  "occurred_at": "2026-09-03T04:31:57Z",
  "actor": "appfusion-coscientist",
  "payload": {
    "app_id": "docvault-lasttime-fusion",
    "registry_revision_before": 12,
    "registry_revision_after": 13,
    "product_commit": "0b49de20b6b0653f8c66d7ebabc026012599d91d",
    "product_boundary_ci_run": 33715028074,
    "product_construction_ci_run": 33715028079,
    "drive_milestone_file_id": "1hOAfnEdrWRymFtgb6GoJp455snxmIAEi",
    "android_keystore_runtime": "PASS",
    "ios_keychain_simulator_runtime": "PASS",
    "apple_adapter_assurance": "SIMULATOR_FEASIBILITY_ONLY_REPLACEABLE_ADAPTER",
    "next_phase": "SECUREBLOB_LOCKED_DOCUMENT_VAULT_SLICE"
  }
}
